{
  "$schema": "https://json-schema.org/draft/2020-12/schema",
  "$id": "urn:sdm:case:1",
  "title": "Contract case",
  "description": "One case of the shared L2 corpus (contract/cases/): a public call and its inputs, how far it runs, and the reference's outcome. The Python runner (contract/runners/run_python.py) makes the public calls; the pure-Rust host (sdm-contract-run) starts the core operations under `core`. A case taken from the Phase 1b inventory keeps every key the inventory gave it.",
  "type": "object",
  "additionalProperties": false,
  "required": ["format", "id", "status", "slice", "paths", "routes", "cells", "input", "until", "expect", "why", "source"],
  "dependentRequired": {"databases": ["exclusion"], "exclusion": ["databases"]},
  "properties": {
    "format": {"const": "sdm-case/1"},
    "id": {"$ref": "#/$defs/id"},
    "status": {
      "description": "acceptance: gating; diagnostic: run and reported, gating nothing (design, Merge rules).",
      "enum": ["acceptance", "diagnostic"]
    },
    "slice": {"enum": ["S0", "S1", "S2", "S3"]},
    "databases": {
      "description": "The databases the case runs on, when not all three (design choice 2, KO2-19): absent, it runs on DuckDB, SQLite and Postgres. Only beside exclusion, the owner's approval for leaving the others out, and leaving at least one out.",
      "type": "array",
      "minItems": 1,
      "maxItems": 2,
      "uniqueItems": true,
      "items": {"enum": ["duckdb", "sqlite", "postgres"]}
    },
    "exclusion": {
      "description": "The decision row (KO<phase>-<n>) whose owner approval lets databases leave a database out; only beside databases.",
      "type": "string",
      "pattern": "^KO[0-9]+-[0-9]+$"
    },
    "paths": {
      "description": "The scope-python.yaml paths this case covers.",
      "$ref": "#/$defs/path_ids"
    },
    "routes": {
      "description": "The paths python-core forces onto the core through SDM_CORE_ROUTES: every path the call may end on, since one call runs its paths on one route.",
      "$ref": "#/$defs/path_ids"
    },
    "seam": {"$ref": "#/$defs/seam"},
    "cells": {"$ref": "#/$defs/cells"},
    "input": {
      "type": "object",
      "additionalProperties": false,
      "required": ["base", "pql", "materialize"],
      "properties": {
        "base": {
          "description": "A base of contract/bases.yaml: DuckDB statements run on a fresh in-memory connection.",
          "$ref": "#/$defs/name"
        },
        "setup": {
          "description": "DuckDB statements run after the base, on the same connection.",
          "$ref": "#/$defs/statements"
        },
        "from_source": {"$ref": "#/$defs/from_source"},
        "edits": {"$ref": "#/$defs/edits"},
        "pql": {"type": "string", "minLength": 1},
        "materialize": {"$ref": "#/$defs/materialize"},
        "fail_call": {
          "description": "The call the scripted endpoint fails, numbered from zero in the order the calls are received (T2.1a's serve(fail_call=), for main's multi-call predict, T2.8c): that call is answered 500 scripted_failure and every other by the rule; absent, no call fails. A JSON integer written as one, below 2**64.",
          "type": "integer",
          "minimum": 0,
          "maximum": 18446744073709551615
        },
        "probabilities": {
          "description": "Whether the scripted endpoint answers a classification call asking for probabilities with them, as a model does (contract/runners/scripted_endpoint.py; T2.8's ranking cases, whose order is their probabilities): a JSON boolean; absent, the rule answers none.",
          "type": "boolean"
        },
        "quantiles": {
          "description": "Whether the scripted endpoint answers a regression call asking for quantiles with them, as a model does (contract/runners/scripted_endpoint.py; T2.9's forecast cases): a JSON boolean; absent, the rule answers none.",
          "type": "boolean"
        },
        "outputs": {
          "description": "The output fields SDMClient.predict asks for (its outputs=), passed as written (T2.9's quantile cases); absent, the call names none and the model's defaults for the task are asked.",
          "type": "array",
          "items": {"type": "string"}
        }
      }
    },
    "until": {
      "description": "The last public call the case makes when nothing refuses: Schema.from_source, then PredictiveQuery.materialize, then SDMClient.predict.",
      "enum": ["from_source", "materialize", "predict"]
    },
    "core": {
      "description": "The core operations the call starts, with the inputs the host passes them. The pure-Rust host starts these; python-core records what its host passed and the comparator holds the two equal.",
      "type": "object",
      "additionalProperties": false,
      "minProperties": 1,
      "properties": {
        "validate_query": {
          "type": "object",
          "additionalProperties": false,
          "required": ["profile", "schema"],
          "properties": {
            "profile": {"description": "The contract's ProfileSpec.", "type": "object"},
            "schema": {"description": "The contract's QuerySchema; the query text is input.pql.", "type": "object"}
          }
        },
        "describe_source": {
          "type": "object",
          "additionalProperties": false,
          "required": ["provider", "source", "check_keys"],
          "properties": {
            "provider": {"description": "The contract's ProviderChoice.", "type": "object"},
            "source": {"description": "The contract's SourceSpec; the data are input.base and input.setup.", "type": "object"},
            "check_keys": {"type": "boolean"}
          }
        },
        "materialize": {
          "description": "materialize's inputs beside the query text, which is input.pql. Not the schema it samples: that is the description describe_source answered, with input.edits made, which each host builds itself; a case naming one is refused (decision E50, the rust-host journey guard).",
          "type": "object",
          "additionalProperties": false,
          "required": ["provider", "indices", "anchor_time", "seed"],
          "properties": {
            "provider": {"description": "The contract's ProviderChoice.", "type": "object"},
            "indices": {"description": "The entities to predict for, one Arrow column: each a contract scalar of one integer or text type. None is a call the core refuses as the reference does (empty.indices, from T1.32d), so the host carries it.", "type": "array", "items": {"type": "object"}},
            "anchor_time": {"description": "The anchor time, a contract ts scalar, or null for the default.", "type": ["object", "null"]},
            "seed": {"description": "The sampling seed as the contract's signed hexadecimal text, or null for the default.", "type": ["string", "null"], "pattern": "^(0x0|-?0x[1-9a-f][0-9a-f]*)$"}
          }
        },
        "predict": {
          "description": "predict's input beside its request state, which is materialize's answer handed back as the host held it, and its request id, which the host draws.",
          "type": "object",
          "additionalProperties": false,
          "required": ["model"],
          "properties": {
            "model": {"description": "The model id the request is sent to.", "type": "string"}
          }
        }
      }
    },
    "expect": {"$ref": "#/$defs/expect"},
    "register": {"type": "string", "minLength": 1},
    "why": {"type": "string", "minLength": 1},
    "source": {"type": "string", "minLength": 1}
  },
  "$defs": {
    "id": {"type": "string", "pattern": "^[a-z0-9][a-z0-9._-]*$"},
    "name": {"type": "string", "pattern": "^[a-z][a-z0-9_-]*$"},
    "path_ids": {
      "type": "array",
      "uniqueItems": true,
      "items": {"type": "string", "pattern": "^[a-z][a-z.-]*/[a-z][a-z0-9-]*/[a-z][a-z0-9-]*$"}
    },
    "seam": {"enum": ["keys", "decimal", "nested", "empty-null", "time", "refusal", "baseline"]},
    "cells": {
      "type": "array",
      "uniqueItems": true,
      "items": {"type": "string", "pattern": "^[a-z0-9-]+/(primary-key|foreign-key|time-column|feature|target)$"}
    },
    "statements": {
      "type": "array",
      "minItems": 1,
      "items": {"type": "string", "minLength": 1}
    },
    "bases": {
      "type": "object",
      "minProperties": 1,
      "propertyNames": {"$ref": "#/$defs/name"},
      "additionalProperties": {"$ref": "#/$defs/statements"}
    },
    "from_source": {
      "description": "Keyword arguments to Schema.from_source; absent means Schema.from_source(source).",
      "type": "object",
      "additionalProperties": false,
      "minProperties": 1,
      "properties": {
        "tables": {"type": ["array", "object"]},
        "primary_keys": {"type": "object"},
        "time_columns": {"type": "object"},
        "relationships": {
          "description": "Each a Relationship(source_table, source_column, target_table, target_column) passed in (T1.21b).",
          "type": "array",
          "items": {
            "type": "object",
            "additionalProperties": false,
            "required": ["source_table", "source_column", "target_table", "target_column"],
            "properties": {
              "source_table": {"type": "string", "minLength": 1},
              "source_column": {"type": "string", "minLength": 1},
              "target_table": {"type": "string", "minLength": 1},
              "target_column": {"type": "string", "minLength": 1}
            }
          }
        }
      }
    },
    "edits": {
      "description": "Edits to the schema Schema.from_source returned, made in order before materialize (T1.21b): clear_time_column sets schema[table].time_column = None; delete_column runs del schema[table][column]; from T1.24b, set_primary_key sets schema[table].primary_key = column, set_time_column sets schema[table].time_column = column, set_stype sets schema[table][column].stype = stype, and set_relationships sets schema.relationships to a Relationship of each link. They finish describing the schema, so a refusal of one is the from_source stage's.",
      "type": "array",
      "minItems": 1,
      "items": {
        "oneOf": [
          {
            "type": "object",
            "additionalProperties": false,
            "required": ["op", "table"],
            "properties": {
              "op": {"const": "clear_time_column"},
              "table": {"type": "string", "minLength": 1}
            }
          },
          {
            "type": "object",
            "additionalProperties": false,
            "required": ["op", "table", "column"],
            "properties": {
              "op": {"const": "delete_column"},
              "table": {"type": "string", "minLength": 1},
              "column": {"type": "string", "minLength": 1}
            }
          },
          {
            "type": "object",
            "additionalProperties": false,
            "required": ["op", "table", "column"],
            "properties": {
              "op": {"const": "set_primary_key"},
              "table": {"type": "string", "minLength": 1},
              "column": {"type": "string", "minLength": 1}
            }
          },
          {
            "type": "object",
            "additionalProperties": false,
            "required": ["op", "table", "column"],
            "properties": {
              "op": {"const": "set_time_column"},
              "table": {"type": "string", "minLength": 1},
              "column": {"type": "string", "minLength": 1}
            }
          },
          {
            "type": "object",
            "additionalProperties": false,
            "required": ["op", "table", "column", "stype"],
            "properties": {
              "op": {"const": "set_stype"},
              "table": {"type": "string", "minLength": 1},
              "column": {"type": "string", "minLength": 1},
              "stype": {"type": "string", "minLength": 1}
            }
          },
          {
            "type": "object",
            "additionalProperties": false,
            "required": ["op", "relationships"],
            "properties": {
              "op": {"const": "set_relationships"},
              "relationships": {
                "type": "array",
                "items": {
                  "type": "object",
                  "additionalProperties": false,
                  "required": ["source_table", "source_column", "target_table", "target_column"],
                  "properties": {
                    "source_table": {"type": "string", "minLength": 1},
                    "source_column": {"type": "string", "minLength": 1},
                    "target_table": {"type": "string", "minLength": 1},
                    "target_column": {"type": "string", "minLength": 1}
                  }
                }
              }
            }
          }
        ]
      }
    },
    "materialize": {
      "description": "Keyword arguments to materialize: anchor_time is an ISO timestamp; indices_as decimal makes each index Decimal(text); inference_config is passed as written (T1.21b). An index is a JSON integer literal of any size, read without loss, or a string; both case loaders refuse a number written with a fraction or an exponent, 1.0 included, which JSON Schema alone would count as an integer.",
      "type": "object",
      "additionalProperties": false,
      "required": ["indices"],
      "properties": {
        "indices": {"type": "array", "items": {"type": ["integer", "string"]}},
        "indices_as": {"const": "decimal"},
        "anchor_time": {"type": "string", "pattern": "^[0-9]{4}-[0-9]{2}-[0-9]{2}"},
        "inference_config": {"type": "object", "minProperties": 1},
        "candidates": {
          "description": "The rows a ranking is over (E153), each an entity key read as indices are: a JSON integer literal of any size or a string.",
          "type": "array",
          "items": {"type": ["integer", "string"]}
        },
        "top_k": {
          "description": "How many of the candidates a ranking or forecast answers, a JSON integer written as one; a value the reference refuses (0) is the case's input.",
          "type": "integer"
        },
        "rows_per_call": {
          "description": "How many entities one model call scores (main's 1fc5a686, T2.8c), passed as written: a JSON integer as an integer of any size, a number written with a fraction or an exponent as a float, true or false as a bool, a string as text, so a value the reference refuses is the case's input.",
          "type": ["integer", "number", "boolean", "string"]
        },
        "lag_timesteps": {
          "description": "How many past steps of the target materialize adds as lagged features (T2.9), passed as written as rows_per_call is: a JSON integer as an integer of any size, a number written with a fraction or an exponent as a float, true or false as a bool, a string as text, so a value the reference refuses is the case's input.",
          "type": ["integer", "number", "boolean", "string"]
        }
      }
    },
    "expect": {
      "description": "The reference's outcome: where the call ended, and for a refusal the exception's class name and StructuredDataError.code (null for one without a code). message and today are for information only.",
      "type": "object",
      "additionalProperties": false,
      "required": ["outcome", "stage"],
      "properties": {
        "outcome": {"enum": ["success", "refusal"]},
        "stage": {"enum": ["from_source", "materialize", "predict"]},
        "error": {"type": "string", "pattern": "^[A-Za-z_][A-Za-z0-9_]*$"},
        "code": {"type": ["string", "null"], "pattern": "^[A-Z][A-Z0-9_]*$"},
        "message": {"type": "string"},
        "today": {"type": "string"}
      },
      "if": {"properties": {"outcome": {"const": "refusal"}}},
      "then": {"required": ["error", "code"]},
      "else": {"not": {"anyOf": [{"required": ["error"]}, {"required": ["code"]}, {"required": ["message"]}]}}
    }
  }
}
