{
  "format": "sdm-case/1",
  "id": "rule.float-nan-key-float",
  "status": "acceptance",
  "slice": "S1",
  "databases": [
    "duckdb",
    "postgres"
  ],
  "exclusion": "KO2-65",
  "paths": [
    "schema.from-source/all-tables/duckdb",
    "query.materialize/indices-regression/duckdb",
    "client.predict/regression/duckdb"
  ],
  "routes": [
    "schema.from-source/all-tables/duckdb",
    "schema.from-source/catalog-keys/duckdb",
    "query.materialize/indices-binary/duckdb",
    "query.materialize/indices-multiclass/duckdb",
    "query.materialize/indices-regression/duckdb",
    "query.materialize/indices-link-prediction/duckdb",
    "query.materialize/indices-ranking/duckdb",
    "query.materialize/indices-forecast/duckdb",
    "client.predict/binary/duckdb",
    "client.predict/multiclass/duckdb",
    "client.predict/regression/duckdb",
    "client.predict/link-prediction/duckdb",
    "client.predict/ranking/duckdb",
    "client.predict/forecast/duckdb"
  ],
  "cells": [],
  "input": {
    "base": "shop",
    "setup": [
      "CREATE OR REPLACE TABLE users AS SELECT CASE WHEN user_id = 3 THEN 'NaN'::FLOAT ELSE user_id::FLOAT END AS user_id, age, country FROM users"
    ],
    "pql": "PREDICT SUM(orders.price, 0, 30, days) FOR EACH users.user_id",
    "materialize": {
      "indices": [
        0,
        1
      ],
      "anchor_time": "2024-03-01"
    }
  },
  "until": "predict",
  "core": {
    "describe_source": {
      "provider": {
        "provider": "sql",
        "dialect": "duckdb"
      },
      "source": {
        "tables": [],
        "primary_keys": {},
        "time_columns": {}
      },
      "check_keys": true
    },
    "materialize": {
      "provider": {
        "provider": "sql",
        "dialect": "duckdb"
      },
      "indices": [
        {
          "t": "i64",
          "v": "0"
        },
        {
          "t": "i64",
          "v": "1"
        }
      ],
      "anchor_time": {
        "t": "ts",
        "v": "1709251200000000000",
        "unit": "ns",
        "zone": null
      },
      "seed": null
    },
    "predict": {
      "model": "kumo-relational"
    }
  },
  "expect": {
    "outcome": "success",
    "stage": "predict",
    "today": "as rule.float-nan-key-double: answered on DuckDB, refused INVALID_REQUEST at materialize on Postgres"
  },
  "why": "As rule.float-nan-key-double, a FLOAT key (rule float_nan; T2.12 round 1)",
  "source": "T2.12 round 1 (Codex P2): float inference as each database previews it, and a NaN key at materialize"
}
