{
  "format": "sdm-case/1",
  "id": "forecast.steps-1",
  "status": "acceptance",
  "slice": "S1",
  "paths": [
    "schema.from-source/all-tables/duckdb",
    "query.materialize/indices-forecast/duckdb",
    "client.predict/forecast/duckdb"
  ],
  "routes": [
    "schema.from-source/all-tables/duckdb",
    "schema.from-source/catalog-keys/duckdb",
    "query.materialize/indices-binary/duckdb",
    "query.materialize/indices-multiclass/duckdb",
    "query.materialize/indices-regression/duckdb",
    "query.materialize/indices-link-prediction/duckdb",
    "query.materialize/indices-ranking/duckdb",
    "query.materialize/indices-forecast/duckdb",
    "client.predict/binary/duckdb",
    "client.predict/multiclass/duckdb",
    "client.predict/regression/duckdb",
    "client.predict/link-prediction/duckdb",
    "client.predict/ranking/duckdb",
    "client.predict/forecast/duckdb"
  ],
  "cells": [
    "int64/primary-key",
    "int64/foreign-key",
    "timestamp-us/time-column"
  ],
  "input": {
    "base": "shop",
    "pql": "PREDICT SUM(orders.price, 0, 7, days) FORECAST 1 TIMEFRAMES FOR EACH users.user_id",
    "materialize": {
      "indices": [
        0,
        1
      ],
      "anchor_time": "2023-03-01"
    }
  },
  "until": "predict",
  "core": {
    "describe_source": {
      "provider": {
        "provider": "sql",
        "dialect": "duckdb"
      },
      "source": {
        "tables": [],
        "primary_keys": {},
        "time_columns": {}
      },
      "check_keys": true
    },
    "materialize": {
      "provider": {
        "provider": "sql",
        "dialect": "duckdb"
      },
      "indices": [
        {
          "t": "i64",
          "v": "0"
        },
        {
          "t": "i64",
          "v": "1"
        }
      ],
      "anchor_time": {
        "t": "ts",
        "v": "1677628800000000000",
        "unit": "ns",
        "zone": null
      },
      "seed": null
    },
    "predict": {
      "model": "kumo-relational"
    }
  },
  "expect": {
    "outcome": "success",
    "stage": "predict",
    "today": "recorded at the reference 6298913c on DuckDB, SQLite and Postgres: 1 call; result columns row_index, id, forecast_step, prediction"
  },
  "why": "num_forecasts of 1, the fewest the reference takes: one step, asked as one regression, its rows numbered as step 1",
  "source": "T2.9 forecasting (the design row T2.9), the reference at 6298913c"
}
