{
  "format": "sdm-case/1",
  "id": "target.static.other-table",
  "status": "acceptance",
  "slice": "S1",
  "paths": [
    "schema.from-source/all-tables/duckdb",
    "query.materialize/indices-regression/duckdb"
  ],
  "routes": [
    "schema.from-source/all-tables/duckdb",
    "schema.from-source/catalog-keys/duckdb",
    "query.validate/accept/any",
    "query.validate/refuse/any",
    "query.materialize/indices-binary/duckdb",
    "query.materialize/indices-multiclass/duckdb",
    "query.materialize/indices-regression/duckdb",
    "query.materialize/indices-link-prediction/duckdb",
    "query.materialize/indices-ranking/duckdb",
    "query.materialize/indices-forecast/duckdb"
  ],
  "cells": [],
  "input": {
    "base": "shop",
    "pql": "PREDICT users.age FOR EACH orders.order_id",
    "materialize": {
      "indices": [
        0,
        1
      ],
      "anchor_time": "2024-03-01"
    }
  },
  "until": "predict",
  "core": {
    "describe_source": {
      "provider": {
        "provider": "sql",
        "dialect": "duckdb"
      },
      "source": {
        "tables": [],
        "primary_keys": {},
        "time_columns": {}
      },
      "check_keys": true
    },
    "validate_query": {
      "profile": {
        "model": null,
        "name": "RELATIONAL"
      },
      "schema": {
        "links": [
          [
            {
              "column": "user_id",
              "table": "orders"
            },
            {
              "column": "user_id",
              "table": "users"
            }
          ]
        ],
        "tables": [
          {
            "columns": [
              {
                "dtype": "int",
                "name": "order_id",
                "stype": "ID"
              },
              {
                "dtype": "int",
                "name": "user_id",
                "stype": "ID"
              },
              {
                "dtype": "float",
                "name": "price",
                "stype": "numerical"
              },
              {
                "dtype": "time",
                "name": "ts",
                "stype": "timestamp"
              }
            ],
            "end_time_column": null,
            "name": "orders",
            "primary_key": "order_id",
            "time_column": "ts"
          },
          {
            "columns": [
              {
                "dtype": "int",
                "name": "user_id",
                "stype": "ID"
              },
              {
                "dtype": "int",
                "name": "age",
                "stype": "numerical"
              },
              {
                "dtype": "string",
                "name": "country",
                "stype": "categorical"
              }
            ],
            "end_time_column": null,
            "name": "users",
            "primary_key": "user_id",
            "time_column": null
          }
        ]
      }
    }
  },
  "expect": {
    "outcome": "refusal",
    "stage": "materialize",
    "error": "StructuredDataError",
    "code": "INVALID_REQUEST",
    "today": "recorded at the reference 6298913c on DuckDB, SQLite and Postgres: the query validator refuses the implicit join (\"Static references to columns from other tables that implicitly contain a foreign key to primary key connection are not supported in foundation model queries.\")"
  },
  "why": "A static column of another table than the entity's, users.age for each order: the query validator refuses the implicit join on both routes before the core's rule static_target is reached, so it is held where the reference holds it",
  "source": "T2.10 PQL targets (the design row: cases per rule), the reference at 6298913c"
}
