{
  "format": "sdm-case/1",
  "id": "multicall.forecast.batched",
  "status": "acceptance",
  "slice": "S1",
  "paths": [
    "schema.from-source/all-tables/duckdb",
    "query.materialize/indices-forecast/duckdb",
    "client.predict/forecast/duckdb"
  ],
  "routes": [
    "schema.from-source/all-tables/duckdb",
    "schema.from-source/catalog-keys/duckdb",
    "query.materialize/indices-binary/duckdb",
    "query.materialize/indices-multiclass/duckdb",
    "query.materialize/indices-regression/duckdb",
    "query.materialize/indices-link-prediction/duckdb",
    "query.materialize/indices-ranking/duckdb",
    "query.materialize/indices-forecast/duckdb",
    "client.predict/binary/duckdb",
    "client.predict/multiclass/duckdb",
    "client.predict/regression/duckdb",
    "client.predict/link-prediction/duckdb",
    "client.predict/ranking/duckdb",
    "client.predict/forecast/duckdb"
  ],
  "cells": [
    "int64/primary-key",
    "int64/foreign-key",
    "timestamp-us/time-column",
    "float64/target"
  ],
  "input": {
    "base": "shop",
    "pql": "PREDICT SUM(orders.price, 0, 30, days) FORECAST 2 TIMEFRAMES FOR EACH users.user_id",
    "materialize": {
      "indices": [
        0,
        1,
        2,
        3,
        4,
        5,
        6,
        7
      ],
      "anchor_time": "2024-03-01",
      "rows_per_call": 3
    }
  },
  "until": "predict",
  "core": {
    "describe_source": {
      "provider": {
        "provider": "sql",
        "dialect": "duckdb"
      },
      "source": {
        "tables": [],
        "primary_keys": {},
        "time_columns": {}
      },
      "check_keys": true
    },
    "materialize": {
      "provider": {
        "provider": "sql",
        "dialect": "duckdb"
      },
      "indices": [
        {
          "t": "i64",
          "v": "0"
        },
        {
          "t": "i64",
          "v": "1"
        },
        {
          "t": "i64",
          "v": "2"
        },
        {
          "t": "i64",
          "v": "3"
        },
        {
          "t": "i64",
          "v": "4"
        },
        {
          "t": "i64",
          "v": "5"
        },
        {
          "t": "i64",
          "v": "6"
        },
        {
          "t": "i64",
          "v": "7"
        }
      ],
      "anchor_time": {
        "t": "ts",
        "v": "1709251200000000000",
        "unit": "ns",
        "zone": null
      },
      "seed": null
    }
  },
  "expect": {
    "outcome": "refusal",
    "stage": "materialize",
    "error": "StructuredDataError",
    "code": "UNSUPPORTED_REQUEST",
    "message": "8 entities are more than the 3 one call scores, and this question is asked as 2 of them, one per step. A part is not batched, and the calls would be the batches times the steps rather than the steps that were counted. Ask about fewer entities at a time"
  },
  "why": "a two-step forecast over 8 entities with rows_per_call=3: a step would take several calls, and a part is not batched; refused UNSUPPORTED_REQUEST at materialize (the batched-forecast refusal)",
  "source": "main's 1fc5a686 (multi-call predict), written by T2.8c's test author"
}
