{
  "format": "sdm-case/1",
  "id": "null.some-times",
  "status": "diagnostic",
  "slice": "S1",
  "paths": [],
  "routes": [],
  "seam": "empty-null",
  "cells": [
    "timestamp-us/time-column"
  ],
  "input": {
    "base": "shop",
    "setup": [
      "UPDATE orders SET ts = NULL WHERE order_id % 10 = 0"
    ],
    "pql": "PREDICT SUM(orders.price, 0, 30, days) FOR EACH users.user_id",
    "materialize": {
      "indices": [
        0,
        1
      ],
      "anchor_time": "2024-03-01"
    }
  },
  "until": "predict",
  "core": {
    "describe_source": {
      "provider": {
        "provider": "sql",
        "dialect": "duckdb"
      },
      "source": {
        "tables": [],
        "primary_keys": {},
        "time_columns": {}
      },
      "check_keys": true
    },
    "materialize": {
      "provider": {
        "provider": "sql",
        "dialect": "duckdb"
      },
      "indices": [
        {
          "t": "i64",
          "v": "0"
        },
        {
          "t": "i64",
          "v": "1"
        }
      ],
      "anchor_time": {
        "t": "ts",
        "v": "1709251200000000000",
        "unit": "ns",
        "zone": null
      },
      "seed": null
    },
    "predict": {
      "model": "kumo-relational"
    }
  },
  "expect": {
    "outcome": "success",
    "stage": "predict"
  },
  "why": "Rows with a null time must be left out of windows, not read as the epoch or a sentinel",
  "source": "DV153; probe#7"
}
