{
  "format": "sdm-case/1",
  "id": "assuming.no-examples",
  "status": "acceptance",
  "slice": "S1",
  "paths": [
    "schema.from-source/all-tables/duckdb",
    "query.materialize/indices-regression/duckdb",
    "client.predict/regression/duckdb"
  ],
  "routes": [
    "schema.from-source/all-tables/duckdb",
    "schema.from-source/catalog-keys/duckdb",
    "query.materialize/indices-binary/duckdb",
    "query.materialize/indices-multiclass/duckdb",
    "query.materialize/indices-regression/duckdb",
    "query.materialize/indices-link-prediction/duckdb",
    "query.materialize/indices-ranking/duckdb",
    "query.materialize/indices-forecast/duckdb",
    "client.predict/binary/duckdb",
    "client.predict/multiclass/duckdb",
    "client.predict/regression/duckdb",
    "client.predict/link-prediction/duckdb",
    "client.predict/ranking/duckdb",
    "client.predict/forecast/duckdb"
  ],
  "cells": [
    "int64/primary-key",
    "int64/foreign-key",
    "timestamp-us/time-column",
    "float64/target"
  ],
  "input": {
    "base": "shop",
    "pql": "PREDICT SUM(orders.price, 0, 30, days) FOR EACH users.user_id ASSUMING COUNT(orders.*, 0, 7, days) > 1",
    "materialize": {
      "indices": [
        0,
        1
      ],
      "anchor_time": "2023-05-01"
    }
  },
  "until": "predict",
  "core": {
    "describe_source": {
      "provider": {
        "provider": "sql",
        "dialect": "duckdb"
      },
      "source": {
        "tables": [],
        "primary_keys": {},
        "time_columns": {}
      },
      "check_keys": true
    },
    "materialize": {
      "provider": {
        "provider": "sql",
        "dialect": "duckdb"
      },
      "indices": [
        {
          "t": "i64",
          "v": "0"
        },
        {
          "t": "i64",
          "v": "1"
        }
      ],
      "anchor_time": {
        "t": "ts",
        "v": "1682899200000000000",
        "unit": "ns",
        "zone": null
      },
      "seed": null
    }
  },
  "expect": {
    "outcome": "refusal",
    "stage": "materialize",
    "error": "StructuredDataError",
    "code": "INVALID_REQUEST",
    "today": "no example meets the assumption: failed to collect any context examples"
  },
  "why": "an assumption no example meets: a value the reference refuses after reading",
  "source": "written by T2.13's test author from the reference at 6298913c"
}
